{
  "schemaVersion": "2.0.0",
  "profileId": "fanasa.contract-policy/2",
  "contractId": "fixture-contract-b",
  "contractVersion": 7,
  "ownerTenantId": "11111111-1111-4111-8111-111111111111",
  "consumerTenantId": "22222222-2222-4222-8222-222222222222",
  "productId": "organization-fabric",
  "offerId": "fixture-organization-offer",
  "subscriptionId": "fixture-subscription-b",
  "status": "Active",
  "validFrom": "2026-10-01T00:00:00.000Z",
  "validTo": "2026-11-01T00:00:00.000Z",
  "effectiveAt": "2026-10-01T00:00:00.000Z",
  "featureEntitlements": [
    "organization.unit.save"
  ],
  "eligibleRoles": [
    "ApiInvoker"
  ],
  "seats": {
    "maximum": 25,
    "unit": "active-membership",
    "scope": "consumer-product-subscription"
  },
  "limits": {
    "allocationId": "fixture-shared-organization",
    "configRevision": 1,
    "scope": {
      "consumerTenantId": "22222222-2222-4222-8222-222222222222",
      "productIds": [
        "organization-fabric"
      ],
      "environments": [
        "development"
      ],
      "operationGroups": [
        "organization"
      ]
    },
    "canonicalScope": "tenant=22222222-2222-4222-8222-222222222222;products=organization-fabric;environments=development;groups=organization",
    "meter": "api.request.admitted",
    "unit": "request",
    "rate": {
      "algorithm": "token-bucket",
      "requestsPerSecond": 5,
      "burstCapacity": 10
    },
    "quota": {
      "algorithm": "fixed-calendar-utc",
      "period": "month",
      "requests": 1000
    }
  },
  "zoneConstraints": [
    "ir-private-1"
  ],
  "pricingReference": {
    "priceId": "fixture-price-reference",
    "priceVersion": 1
  },
  "policy": {
    "policyId": "fixture-organization-unit-save",
    "policyVersion": 3,
    "templateId": "organization-unit-save/1",
    "combiningAlgorithm": "deny-overrides",
    "explicitDenyActions": []
  }
}
